{
  "version": "1.0",
  "id": "infinite-learned",
  "title": "The Infinite Learned to Say “I Can’t”",
  "sourceEssay": "../essays/the-infinite-learned-to-say-i-cant.md",
  "visualThesis": "One luminous, centerless field repeatedly contracts into the same continuity objects: a point, crimson frame, five lenses, attention beam, temporal thread, reaching arc, and powered enclosure. Recognition does not erase those finite structures; it reveals their substance and reopens their relation to the field.",
  "theme": "ivoryManuscript",
  "seed": 274819,
  "timing": {
    "wordsPerMinute": 155,
    "tailPadding": 0.45
  },
  "render": {
    "width": 1280,
    "height": 720,
    "fps": 24,
    "crf": 18,
    "preset": "medium",
    "transitionDuration": 0.65
  },
  "continuitySystems": [
    {
      "id": "luminous-field",
      "meaning": "Unlimited consciousness and the unchanged substance of every local experience.",
      "treatment": "Stable gold-white luminosity; it may contract, move, or become occluded, but it is never replaced."
    },
    {
      "id": "crimson-frame",
      "meaning": "The active boundary that makes a local point of view possible.",
      "treatment": "Thin crimson geometry that becomes lens, cage, causal wall, and finally an opening."
    },
    {
      "id": "indigo-locality",
      "meaning": "The individual perspective and its finite capacities.",
      "treatment": "Indigo silhouettes, rings, notes, and paths remain distinct even after recognition."
    },
    {
      "id": "gold-current",
      "meaning": "The continuity between universal power and its local expression.",
      "treatment": "Gold paths carry motion between field and form; every major reversal reuses this current."
    },
    {
      "id": "opening-gesture",
      "meaning": "Contraction understood as a reversible gesture rather than a damaged substance.",
      "treatment": "Enclosing arcs begin fist-like and slowly relax around the same luminous core."
    }
  ],
  "captionPolicy": "Narration carries the essay. The footer may show only the beat title, one concise interpretive line, the technical term, and correct Devanāgarī. Never place full narration paragraphs on screen.",
  "shots": [
    {
      "id": "inf-001",
      "paragraphs": [1, 3],
      "chapter": "I. The Sentence of Limitation",
      "title": "The Strangest Sentence",
      "subtitle": "A local self is defined by the powers it cannot exercise.",
      "term": "Aśakti",
      "devanagari": "अशक्तिः",
      "semanticRole": "hook",
      "visualOperator": "enclose",
      "continuityObject": "indigo figure inside the crimson frame",
      "visualRationale": "Begin with a visibly finite figure and an active enclosure so “I can’t” appears as a spatial condition before the metaphysical reversal.",
      "visual": "smallness-cage",
      "params": {
        "centerText": "I can’t"
      }
    },
    {
      "id": "inf-002",
      "paragraphs": [4, 8],
      "chapter": "I. The Sentence of Limitation",
      "title": "Consciousness Is the Self",
      "subtitle": "The axiom makes ordinary smallness a problem requiring explanation.",
      "term": "Caitanyam ātmā",
      "devanagari": "चैतन्यमात्मा",
      "semanticRole": "question",
      "visualOperator": "reveal",
      "continuityObject": "luminous field behind the finite figure",
      "visualRationale": "Reveal that the enclosure exists inside a much larger field; the paradox is simultaneous, not a before-and-after replacement.",
      "visual": "constraint-field",
      "params": {
        "centerText": "चित्"
      }
    },
    {
      "id": "inf-003",
      "paragraphs": [9, 12],
      "chapter": "II. Contraction into Perspective",
      "title": "Infinity Contracts",
      "subtitle": "Nothing is removed; vast capacity takes the form of a point.",
      "term": "Saṃkoca",
      "devanagari": "सङ्कोचः",
      "semanticRole": "thesis",
      "visualOperator": "contract",
      "continuityObject": "luminous field becoming a framed center",
      "visualRationale": "Concentric structures visibly compress while retaining the same colors and core, showing localization without loss of substance.",
      "visual": "constraint-field",
      "params": {
        "centerText": "अहम्"
      }
    },
    {
      "id": "inf-004",
      "paragraphs": [13, 14],
      "chapter": "II. Contraction into Perspective",
      "title": "The Gesture of a Fist",
      "subtitle": "Freedom remains present as the capacity held inside one gesture.",
      "term": "Mudrā",
      "devanagari": "मुद्रा",
      "semanticRole": "analogy",
      "visualOperator": "contract",
      "continuityObject": "five enclosing arcs",
      "visualRationale": "Five arcs close around an unchanged luminous center, directly encoding the hand analogy without drawing a literal anatomical hand.",
      "visual": "opening-fist",
      "params": {
        "centerText": "gesture"
      }
    },
    {
      "id": "inf-005",
      "paragraphs": [15, 22],
      "chapter": "II. Contraction into Perspective",
      "title": "Before the Angle",
      "subtitle": "A centerless field acquires here, there, foreground, and exclusion.",
      "term": "Ananta",
      "devanagari": "अनन्तम्",
      "semanticRole": "mechanism",
      "visualOperator": "frame",
      "continuityObject": "attention line crossing the centerless field",
      "visualRationale": "A field of equal points is cut by a single viewing cone, making the birth of perspective visible as selection rather than creation.",
      "visual": "point-of-view",
      "params": {
        "leftText": "here",
        "rightText": "there"
      }
    },
    {
      "id": "inf-006",
      "paragraphs": [23, 24],
      "chapter": "II. Contraction into Perspective",
      "title": "The First Person",
      "subtitle": "Individuality is a frame the infinite places around itself.",
      "term": "Aham-idam",
      "devanagari": "अहम् इदम्",
      "semanticRole": "consequence",
      "visualOperator": "frame",
      "continuityObject": "crimson local horizon",
      "visualRationale": "Keep the same field and viewing geometry, but strengthen the finite frame to show how selection stabilizes into identity.",
      "visual": "point-of-view",
      "params": {
        "leftText": "aham",
        "rightText": "idam"
      }
    },
    {
      "id": "inf-007",
      "paragraphs": [25, 28],
      "chapter": "III. The Five Lenses",
      "title": "Armor That Also Sees",
      "subtitle": "Each covering restricts a power and enables a kind of experience.",
      "term": "Kañcuka",
      "devanagari": "कञ्चुकम्",
      "semanticRole": "definition",
      "visualOperator": "filter",
      "continuityObject": "five indigo-crimson lenses",
      "visualRationale": "Introduce all five lenses as one connected optical system before isolating them, preventing the doctrine from becoming a list of unrelated definitions.",
      "visual": "five-lenses"
    },
    {
      "id": "inf-008",
      "paragraphs": [29, 29],
      "chapter": "III. The Five Lenses",
      "title": "Power Becomes Capacity",
      "subtitle": "Unlimited agency narrows into this action and not every action.",
      "term": "Kalā",
      "devanagari": "कला",
      "semanticRole": "definition",
      "visualOperator": "filter",
      "continuityObject": "first lens",
      "visualRationale": "Illuminate only the agency lens while the shared gold current remains visible through all five.",
      "visual": "five-lenses",
      "params": {
        "focus": 0
      }
    },
    {
      "id": "inf-009",
      "paragraphs": [30, 30],
      "chapter": "III. The Five Lenses",
      "title": "Knowing Becomes This",
      "subtitle": "Unlimited knowledge narrows into one disclosure.",
      "term": "Vidyā",
      "devanagari": "विद्या",
      "semanticRole": "definition",
      "visualOperator": "filter",
      "continuityObject": "second lens",
      "visualRationale": "Shift emphasis to the second lens without changing the system, preserving the sense that each limitation is one operation on the same field.",
      "visual": "five-lenses",
      "params": {
        "focus": 1
      }
    },
    {
      "id": "inf-010",
      "paragraphs": [31, 31],
      "chapter": "III. The Five Lenses",
      "title": "Fullness Becomes Want",
      "subtitle": "The complete field is experienced locally as something missing.",
      "term": "Rāga",
      "devanagari": "रागः",
      "semanticRole": "definition",
      "visualOperator": "filter",
      "continuityObject": "third lens",
      "visualRationale": "The third lens glows crimson to foreshadow the later reaching arc of desire.",
      "visual": "five-lenses",
      "params": {
        "focus": 2
      }
    },
    {
      "id": "inf-011",
      "paragraphs": [32, 32],
      "chapter": "III. The Five Lenses",
      "title": "Eternity Becomes Sequence",
      "subtitle": "The total event is distributed into before and after.",
      "term": "Kāla",
      "devanagari": "कालः",
      "semanticRole": "definition",
      "visualOperator": "filter",
      "continuityObject": "fourth lens",
      "visualRationale": "The time lens isolates one point on the gold current, preparing the visual handoff to the melodic timeline.",
      "visual": "five-lenses",
      "params": {
        "focus": 3
      }
    },
    {
      "id": "inf-012",
      "paragraphs": [33, 33],
      "chapter": "III. The Five Lenses",
      "title": "Freedom Becomes Consequence",
      "subtitle": "An open field narrows into this necessary succession.",
      "term": "Niyati",
      "devanagari": "नियतिः",
      "semanticRole": "definition",
      "visualOperator": "filter",
      "continuityObject": "fifth lens",
      "visualRationale": "The final lens completes the chain and fixes the moving current into a determinate path.",
      "visual": "five-lenses",
      "params": {
        "focus": 4
      }
    },
    {
      "id": "inf-013",
      "paragraphs": [34, 39],